{
    "popup_id": "newsletter_modal",
    "title": "Sign up for Exclusive Deals",
    "description": "<p>Get exclusive offers, new menu sneak peak, and updates!</p>",
    "image": "/images/elements/baguette-beef.webp",
    "image_position": "w-28 md:w-39 h-auto absolute left-1/2 -translate-x-1/2 -top-9 md:-top-18",
    "show_on_load": true,
    "remember_close": true
}
